{
  "schemaVersion": 1,
  "id": "galaxyTrucker",
  "name": "Galaxy Trucker",
  "publisher": "Czech Games Edition",
  "sources": [
    {
      "title": "La guía del transportista galáctico (2ª edición)",
      "file": "galaxy_trucker.pdf"
    }
  ],
  "players": {
    "min": 2,
    "max": 4,
    "default": 4
  },
  "options": [
    {
      "id": "mode",
      "label": "¿Qué vais a jugar?",
      "type": "choice",
      "default": "trip",
      "choices": [
        {
          "value": "intro",
          "label": "Vuelo de iniciación (tablero L, primera partida)"
        },
        {
          "value": "single",
          "label": "Un solo vuelo de nivel I, II o III"
        },
        {
          "value": "trip",
          "label": "Travesía Intergaláctica (vuelos I, II y III)"
        }
      ]
    },
    {
      "id": "level",
      "label": "Nivel del vuelo",
      "type": "choice",
      "default": 1,
      "when": {
        "eq": [
          "mode",
          "single"
        ]
      },
      "choices": [
        {
          "value": 1,
          "label": "I"
        },
        {
          "value": 2,
          "label": "II"
        },
        {
          "value": 3,
          "label": "III"
        }
      ]
    }
  ],
  "vars": {
    "levelName": [
      {
        "when": {
          "eq": [
            "mode",
            "trip"
          ]
        },
        "value": "I"
      },
      {
        "when": {
          "eq": [
            "level",
            2
          ]
        },
        "value": "II"
      },
      {
        "when": {
          "eq": [
            "level",
            3
          ]
        },
        "value": "III"
      },
      {
        "value": "I"
      }
    ]
  },
  "sections": [
    {
      "id": "intro",
      "title": "Vuelo de iniciación",
      "when": {
        "eq": [
          "mode",
          "intro"
        ]
      },
      "steps": [
        {
          "id": "board",
          "who": "table",
          "text": "Usa el tablero de vuelo marcado con una «L»."
        },
        {
          "id": "deck",
          "who": "table",
          "text": "Toma las 8 cartas de aventura de nivel I marcadas para el primer vuelo y barájalas boca abajo: son el mazo de aventuras."
        }
      ]
    },
    {
      "id": "flight",
      "title": "Vuelo de nivel {levelName}",
      "when": {
        "not": {
          "eq": [
            "mode",
            "intro"
          ]
        }
      },
      "steps": [
        {
          "id": "boardGlass",
          "who": "table",
          "text": "Tablero de vuelo y reloj:",
          "group": true,
          "substeps": [
            {
              "id": "board",
              "text": "Usa el tablero de vuelo de nivel {levelName}."
            },
            {
              "id": "hourglass",
              "text": "Deja el reloj de arena junto al tablero de vuelo."
            }
          ]
        },
        {
          "id": "piles",
          "who": "table",
          "text": "Baraja por separado los mazos de aventura y forma 4 pilas sin mirar, con la composición que indica el tablero de vuelo. Pon 3 pilas en la zona inferior (se pueden consultar al construir) y 1 en la superior (sorpresa).",
          "tip": "Por ejemplo, en nivel III cada pila lleva 2 cartas de nivel III, 1 de nivel II y 1 de nivel I."
        },
        {
          "id": "titles",
          "who": "table",
          "when": {
            "eq": [
              "mode",
              "trip"
            ]
          },
          "text": "Elige al azar tantas fichas de título como jugadores, déjalas por la cara de plata junto al tablero de vuelo y leed en voz alta qué premia cada una."
        }
      ]
    },
    {
      "id": "common",
      "title": "Componentes y naves",
      "steps": [
        {
          "id": "tilesDice",
          "who": "table",
          "text": "Losetas y dados:",
          "group": true,
          "substeps": [
            {
              "id": "tiles",
              "text": "Pon todas las losetas de componente boca abajo en el centro de la mesa y mézclalas bien."
            },
            {
              "id": "dice",
              "text": "Deja a mano los 2 dados."
            }
          ]
        },
        {
          "id": "yourShip",
          "who": "eachPlayer",
          "text": "Tu nave:",
          "group": true,
          "substeps": [
            {
              "id": "shipBoards",
              "text": "Cada jugador coge un tablero de nave y lo usa por la cara del nivel {levelName}."
            },
            {
              "id": "color",
              "text": "Cada jugador elige color, coge sus cohetes y su cabina inicial, y coloca la cabina en el centro de su tablero de nave."
            },
            {
              "id": "rockets",
              "text": "Pon un cohete en tu tablero de nave y el otro en el aparcamiento del tablero de vuelo."
            }
          ]
        },
        {
          "id": "go",
          "who": "table",
          "text": "Cuando estéis listos, el más valiente grita «¡Ya!» y empezáis a construir a la vez, cogiendo losetas con una sola mano."
        }
      ]
    }
  ],
  "reference": [
    {
      "id": "build",
      "title": "Construcción",
      "items": [
        {
          "id": "grab",
          "text": "A la vez: coge 1 loseta boca abajo, mírala y suéldala a tu nave o déjala boca arriba en el centro. Solo puedes tener 1 en la mano."
        },
        {
          "id": "finish",
          "text": "Al terminar, coge la ficha de orden más baja libre: marca tu posición de salida. Cuando el reloj de arena acaba en la última casilla, se acaba el tiempo."
        },
        {
          "id": "check",
          "text": "Revisión: conectores que no encajan, motores sin nada detrás y cañones sin nada delante se quitan."
        }
      ]
    },
    {
      "id": "flight",
      "title": "Vuelo",
      "items": [
        {
          "id": "cards",
          "text": "El líder revela las cartas de aventura una a una y se resuelven en orden de vuelo."
        },
        {
          "id": "retire",
          "text": "Te retiras si pierdes a todos tus humanos, no tienes motores en el espacio sideral o te doblan. También puedes abandonar antes de revelar una carta."
        }
      ]
    }
  ],
  "scoring": {
    "categories": [
      {
        "id": "previous",
        "label": "Créditos de vuelos anteriores",
        "when": {
          "eq": [
            "mode",
            "trip"
          ]
        }
      },
      {
        "id": "arrival",
        "label": "Recompensa por llegada",
        "help": "Según el orden de llegada (en el tablero de vuelo)."
      },
      {
        "id": "ship",
        "label": "Mejor nave",
        "help": "Para quien tenga menos conectores expuestos (empate: todos)."
      },
      {
        "id": "cargo",
        "label": "Venta de mercancías",
        "help": "A mitad de precio si te retiraste."
      },
      {
        "id": "titles",
        "label": "Títulos",
        "when": {
          "eq": [
            "mode",
            "trip"
          ]
        }
      },
      {
        "id": "lost",
        "label": "Componentes perdidos",
        "help": "1 crédito por cada uno.",
        "negative": true
      }
    ],
    "notes": "Con más de 0 créditos ya has ganado; quien tenga más, gana un poco más."
  }
}
